{
  "$schema": "https://json-schema.org/draft/2020-12/schema",
  "$id": "urn:agent-evals-standard:schema:evaluation-profile:1",
  "title": "Versioned evaluation profile",
  "$comment": "A profile is a complete standalone declaration that narrows the base under PROFILE-001. Set values use closed-enum order and keyed collections use lexical key order. The top-level digest is SHA-256 over RFC 8785 JCS with only the top-level digest omitted (full_document_without_digest).",
  "type": "object",
  "required": ["schemaVersion", "id", "namespace", "owner", "version", "baseCompatibility", "supportedAssuranceLevels", "effectiveRiskRange", "capabilityFamilies", "interactionModes", "workArtifactRegistry", "allowedOutcomeProfiles", "caseContract", "gateRegistry", "caseQa", "metrics", "failureTaxonomy", "additionalAssuranceRequirements", "exclusions", "fixtures", "digest"],
  "properties": {
    "schemaVersion": { "const": "agent-eval-evaluation-profile-1" },
    "id": { "$ref": "#/$defs/id" }, "namespace": { "type": "string", "pattern": "^[A-Za-z0-9][A-Za-z0-9_.-]*$" },
    "owner": { "type": "object", "required": ["id", "role"], "properties": { "id": { "$ref": "#/$defs/id" }, "role": { "type": "string", "minLength": 1 } }, "additionalProperties": false },
    "version": { "type": "string", "minLength": 1 },
    "baseCompatibility": { "$comment": "Binds the standard version, verdict, and requirement-registry identity, version, and digest. A document-relative URI may differ only when it resolves to that same artifact.", "type": "object", "required": ["standardVersion", "requirementRegistry", "verdict"], "properties": { "standardVersion": { "const": "0.1.0" }, "requirementRegistry": { "$ref": "#/$defs/artifactPointer" }, "verdict": { "const": "compatible_no_weakening" } }, "additionalProperties": false },
    "supportedAssuranceLevels": { "$comment": "A complete declaration that is a nonempty subset of the base levels.", "type": "array", "minItems": 1, "items": { "enum": ["A1", "A2", "A3"] }, "uniqueItems": true },
    "effectiveRiskRange": { "$comment": "A complete declaration that is a nonempty subset of the base risk tiers. This range is only a profile eligibility boundary. The actual case, experiment, and decision tiers come from authenticated risk-assessment-1 records and are not inferred from this range.", "type": "array", "minItems": 1, "items": { "enum": ["low", "medium", "high", "critical"] }, "uniqueItems": true },
    "capabilityFamilies": { "$comment": "A complete declaration that is a nonempty subset of the base capability families.", "type": "array", "minItems": 1, "items": { "$ref": "#/$defs/capabilityFamilyId" }, "uniqueItems": true },
    "interactionModes": { "$comment": "A complete declaration of closed concrete IDs that is a nonempty subset of the base interaction modes.", "type": "array", "minItems": 1, "items": { "$ref": "#/$defs/interactionModeId" }, "uniqueItems": true },
    "workArtifactRegistry": { "$comment": "The sole authenticated work-artifact-type to capability-family mapping. Resolves to one authenticated artifact; a document-relative URI may differ only when it resolves to that exact artifact.", "$ref": "#/$defs/artifactPointer" },
    "allowedOutcomeProfiles": { "$comment": "The complete nonempty list of outcome profiles this evaluation profile supports. Each retains the base normalized primary outcomes and requirements under PROFILE-001; native outcome IDs and result contracts are profile-owned.", "type": "array", "minItems": 1, "items": { "$ref": "#/$defs/artifactPointer" } },
    "caseContract": { "$comment": "The versioned profile-specific case-shape contract. Resolves to one authenticated artifact; a document-relative URI may differ only when it resolves to that exact artifact.", "$ref": "#/$defs/artifactPointer" },
    "gateRegistry": { "$comment": "Must preserve or strengthen every applicable base gate.", "$ref": "#/$defs/artifactPointer" }, "caseQa": { "$comment": "Must preserve or strengthen every applicable base QA obligation.", "$ref": "#/$defs/artifactPointer" },
    "metrics": { "$comment": "A complete declaration keyed by id.", "type": "array", "minItems": 1, "items": { "$ref": "#/$defs/artifactPointer" } }, "failureTaxonomy": { "$comment": "Must not weaken or lose any applicable base cause, attribution, or fail-closed outcome.", "$ref": "#/$defs/artifactPointer" },
    "additionalAssuranceRequirements": { "$comment": "The base standard owns A1-A3 semantics. These entries are additive only; semantic validation must union them with the base level and all lower levels and must reject deletion, replacement, downgrade, or reinterpretation of a base assurance requirement.", "type": "array", "items": { "$ref": "#/$defs/additionalAssuranceRequirement" } },
    "exclusions": { "type": "array", "items": { "type": "object", "required": ["scope", "reason", "claimEffect"], "properties": { "scope": { "type": "string", "minLength": 1 }, "reason": { "type": "string", "minLength": 1 }, "claimEffect": { "enum": ["not_applicable", "insufficient_evidence", "forbidden"] } }, "additionalProperties": false } },
    "fixtures": { "$comment": "Semantic validation must authenticate an evaluator-pinned manifest and evaluator-pinned executor, resolve manifestExpectationId exactly once, execute that expectation under its declared schema and semantic checks, and require the observed result to match both manifest valid and expectedVerdict. A negative must fail for manifest expectedError. Descriptor-supplied validators or reports and execution cycles are invalid.", "type": "array", "minItems": 2, "contains": { "type": "object", "properties": { "expectedVerdict": { "const": "pass" } }, "required": ["expectedVerdict"] }, "minContains": 1, "items": { "type": "object", "required": ["id", "manifestUri", "manifestDigest", "manifestExpectationId", "expectedVerdict"], "properties": { "id": { "$ref": "#/$defs/id" }, "manifestUri": { "type": "string", "minLength": 1 }, "manifestDigest": { "$ref": "#/$defs/digest" }, "manifestExpectationId": { "$ref": "#/$defs/id" }, "expectedVerdict": { "enum": ["pass", "fail"] } }, "additionalProperties": false }, "allOf": [{ "contains": { "type": "object", "properties": { "expectedVerdict": { "const": "fail" } }, "required": ["expectedVerdict"] }, "minContains": 1 }] },
    "digest": { "$ref": "#/$defs/digest" }
  },
  "additionalProperties": false,
  "$defs": {
    "id": { "type": "string", "pattern": "^[A-Za-z0-9][A-Za-z0-9_.:-]*$" }, "digest": { "type": "string", "pattern": "^sha256:[a-f0-9]{64}$" },
    "capabilityFamilyId": { "enum": ["CAP.DISCOVER_SPECIFY", "CAP.PLAN_DESIGN", "CAP.IMPLEMENT_CHANGE", "CAP.VERIFY_ASSURE", "CAP.REVIEW_DECIDE", "CAP.RELEASE_OPERATE", "CAP.REMEDIATE_LEARN"] },
    "interactionModeId": { "enum": ["noninteractive_repository_task", "interactive_repository_session", "pull_request_workflow", "ci_or_release_workflow"] },
    "additionalAssuranceRequirement": { "type": "object", "required": ["id", "minimumLevel", "requirementIds", "verificationContract"], "properties": { "id": { "$ref": "#/$defs/id" }, "minimumLevel": { "enum": ["A1", "A2", "A3"] }, "requirementIds": { "type": "array", "minItems": 1, "items": { "$ref": "#/$defs/id" }, "uniqueItems": true }, "verificationContract": { "$ref": "#/$defs/artifactPointer" } }, "additionalProperties": false },
    "artifactPointer": { "$comment": "For profile artifact pointers, resolve uri and use the target schema's declared self-digest projection when one is defined, recomputing it and verifying any stored self-digest; otherwise digest is SHA-256 of the stored bytes. This rule does not change {path,commit,digest} reference semantics.", "type": "object", "required": ["id", "version", "uri", "digest"], "properties": { "id": { "$ref": "#/$defs/id" }, "version": { "type": "string", "minLength": 1 }, "uri": { "type": "string", "minLength": 1 }, "digest": { "$ref": "#/$defs/digest" } }, "additionalProperties": false }
  }
}
