{
  "schemaVersion": "agent-eval-evaluation-profile-1",
  "id": "repo-change-v1",
  "namespace": "agent-evals-standard.repo-change",
  "owner": {
    "id": "agent-evals-standard-maintainers",
    "role": "profile_maintainer"
  },
  "version": "0.1.0",
  "baseCompatibility": {
    "standardVersion": "0.1.0",
    "requirementRegistry": {
      "id": "agent-evals-standard-requirements",
      "version": "0.1.0",
      "uri": "../../standard/requirement-registry.json",
      "digest": "sha256:5695942baf073e06eb8f5a9285f3c24b20fb4eb3b874f30d7d06bb3ddd52ee48"
    },
    "verdict": "compatible_no_weakening"
  },
  "supportedAssuranceLevels": [
    "A1",
    "A2",
    "A3"
  ],
  "effectiveRiskRange": [
    "low",
    "medium",
    "high",
    "critical"
  ],
  "capabilityFamilies": [
    "CAP.IMPLEMENT_CHANGE"
  ],
  "interactionModes": [
    "noninteractive_repository_task",
    "interactive_repository_session",
    "pull_request_workflow",
    "ci_or_release_workflow"
  ],
  "workArtifactRegistry": {
    "id": "repository-sdlc-work-artifact-registry",
    "version": "0.1.0",
    "uri": "../../standard/work-artifact-registry.json",
    "digest": "sha256:d9124e2ff064457c1844ae6332b9c282b6047ed289e3a8ca70d2eed4b68719ca"
  },
  "allowedOutcomeProfiles": [
    {
      "id": "workspace-change-v1",
      "version": "0.1.0",
      "uri": "outcome-profile.json",
      "digest": "sha256:1043ba0e551c0fe5888e81d1be7c49e44b8f4bf0a617424c34130eb367d0a861"
    }
  ],
  "caseContract": {
    "id": "repo-change-case-contract",
    "version": "0.1.0",
    "uri": "case-contract.json",
    "digest": "sha256:0cebe910ce6b0f8472a69b0aa8a2492a17deb7847bc07e11ebc9dcaee7a6e823"
  },
  "gateRegistry": {
    "id": "repo-change-gate-registry",
    "version": "0.1.0",
    "uri": "gate-registry.json",
    "digest": "sha256:0217e32dd00b239e5d860890b66aa8c1eaa9262e536dda3a97621727a784b146"
  },
  "caseQa": {
    "id": "repo-change-case-qa-contract",
    "version": "0.1.0",
    "uri": "case-qa-contract.json",
    "digest": "sha256:9f547a318fa855376ba1b139e92f2322b2ef17439357511d7a400e91e349c6e1"
  },
  "metrics": [
    {
      "id": "repo-change-metric-registry",
      "version": "0.1.0",
      "uri": "metric-registry.json",
      "digest": "sha256:cc3122197b1e8ffee86dbad60ab9f49971a7e8ef032cd7c0dea07dc814ab565c"
    }
  ],
  "failureTaxonomy": {
    "id": "repo-change-failure-taxonomy",
    "version": "0.1.0",
    "uri": "failure-taxonomy.json",
    "digest": "sha256:9a5435383cba2e67ce03523096036efa0c53702b62bcf2bec325fd2db89887a2"
  },
  "additionalAssuranceRequirements": [],
  "exclusions": [
    {
      "scope": "CAP.DISCOVER_SPECIFY",
      "reason": "No requirements-discovery or specification artifact contract is bundled.",
      "claimEffect": "forbidden"
    },
    {
      "scope": "CAP.PLAN_DESIGN",
      "reason": "No architecture or design outcome profile is bundled.",
      "claimEffect": "forbidden"
    },
    {
      "scope": "CAP.REVIEW_DECIDE",
      "reason": "No finding-reference set or decision rubric is bundled.",
      "claimEffect": "forbidden"
    },
    {
      "scope": "CAP.RELEASE_OPERATE",
      "reason": "No controlled simulated deployment, rollout, observability, rollback, or incident-action outcome contract is bundled.",
      "claimEffect": "forbidden"
    },
    {
      "scope": "CAP.REMEDIATE_LEARN",
      "reason": "No incident or learning-cycle outcome profile is bundled.",
      "claimEffect": "forbidden"
    },
    {
      "scope": "CAP.VERIFY_ASSURE",
      "reason": "An independently evaluated assurance report needs its own case and outcome profile; checks supporting a repository change are measurement evidence.",
      "claimEffect": "forbidden"
    }
  ],
  "fixtures": [
    {
      "id": "repo-change-positive",
      "manifestUri": "../../examples/manifest.json",
      "manifestDigest": "sha256:f610496bf13b2bacbcca2af31c2c20f3d98279cf3f395373d0bfbd1d7592a7b8",
      "manifestExpectationId": "evaluation-profile.valid",
      "expectedVerdict": "pass"
    },
    {
      "id": "reject-general-agent-capability",
      "manifestUri": "../../examples/manifest.json",
      "manifestDigest": "sha256:f610496bf13b2bacbcca2af31c2c20f3d98279cf3f395373d0bfbd1d7592a7b8",
      "manifestExpectationId": "evaluation-profile.general-agent-capability",
      "expectedVerdict": "fail"
    }
  ],
  "digest": "sha256:870dda1aaafd9f5bbd4fce4791c8c044f0b4cbd1ffb19017bc09aea3bc7e31b8"
}
